{
  "version": "stint.scorecard/1",
  "live": true,
  "k": 3,
  "generatedAt": "2026-10-30T09:36:00.000Z",
  "models": [
    {
      "source": "attempts",
      "role": "implementer",
      "adapter": "stint-agent",
      "model": "muse-spark-open",
      "host": "baseten",
      "runs": 3
    },
    {
      "source": "attempts",
      "role": "reviewer",
      "adapter": "openai-compatible",
      "model": "muse-glimmer:30b-mlx",
      "host": "ollama",
      "runs": 2
    },
    {
      "source": "relays",
      "role": "implementer",
      "adapter": "muse-code",
      "model": "muse-spark-1.3",
      "host": "local-cli",
      "runs": 1
    },
    {
      "source": "relays",
      "role": "implementer",
      "adapter": "claude-code",
      "model": "muse-glimmer:30b-mlx",
      "host": "ollama",
      "runs": 1
    },
    {
      "source": "relays",
      "role": "implementer",
      "adapter": "codex",
      "model": "muse-spark-1.3",
      "host": "meta-api",
      "runs": 1
    }
  ],
  "tasks": [
    {
      "id": "ms-unit-option",
      "repo": "ms",
      "attempts": 1,
      "green": 0,
      "pass1": {
        "value": null,
        "n": 0
      },
      "passK": {
        "value": null,
        "n": 0
      }
    },
    {
      "id": "negotiator-preferred",
      "repo": "negotiator",
      "attempts": 3,
      "green": 1,
      "pass1": {
        "value": 0.3333,
        "n": 3
      },
      "passK": {
        "value": 0,
        "n": 3
      }
    }
  ],
  "overall": {
    "pass1": {
      "value": 0.3333,
      "n": 3
    },
    "passK": {
      "value": 0,
      "n": 1
    }
  },
  "handoff": {
    "value": 0.5,
    "n": 2,
    "green": 1,
    "relays": [
      "negotiator-2"
    ]
  },
  "review": {
    "n": 2,
    "caught": 1,
    "missed": 0,
    "falseAlarm": 0,
    "agreed": 1
  },
  "badPatches": {
    "n": 2,
    "byTests": {
      "value": 0.5,
      "n": 2
    },
    "byTestsAndReview": {
      "value": 1,
      "n": 2
    }
  },
  "perGreen": {
    "usd": {
      "value": 0.2811,
      "n": 1,
      "unpriced": 0
    },
    "wallMs": {
      "value": 512000,
      "n": 1
    }
  },
  "spend": {
    "usd": 0.824,
    "estimated": true
  },
  "attempts": [
    {
      "live": true,
      "stintTask": "T-0001",
      "run": null,
      "adapter": "stint-agent",
      "model": "muse-spark-open",
      "host": "baseten",
      "endedBy": null,
      "retried": [],
      "estimated": true,
      "task": "ms-unit-option",
      "repo": "ms",
      "attempt": 1,
      "tests": null,
      "hidden": null,
      "scenarios": null,
      "review": null,
      "usd": null,
      "wallMs": null,
      "outcome": "failed: POST /api/tasks/T-0001/assign answered 503",
      "startedAt": "2026-10-30T09:34:00.000Z",
      "finishedAt": "2026-10-30T09:35:00.000Z"
    },
    {
      "live": true,
      "stintTask": "T-0001",
      "run": "r1",
      "adapter": "stint-agent",
      "model": "muse-spark-open",
      "host": "baseten",
      "endedBy": "completed",
      "retried": [],
      "estimated": false,
      "task": "negotiator-preferred",
      "repo": "negotiator",
      "attempt": 1,
      "tests": "green",
      "hidden": "green",
      "scenarios": {
        "passed": 261,
        "failed": 0
      },
      "review": {
        "verdict": "approve",
        "findings": [],
        "adapter": "openai-compatible",
        "model": "muse-glimmer:30b-mlx",
        "host": "ollama",
        "offline": true
      },
      "usd": 0.2811,
      "wallMs": 512000,
      "outcome": "graded green by the hidden tests; the run ended completed and its own tests were green; the review answered approve",
      "startedAt": "2026-10-30T09:00:00.000Z",
      "finishedAt": "2026-10-30T09:11:02.000Z"
    },
    {
      "live": true,
      "stintTask": "T-0001",
      "run": "r1",
      "adapter": "stint-agent",
      "model": "muse-spark-open",
      "host": "baseten",
      "endedBy": "completed",
      "retried": [],
      "estimated": false,
      "task": "negotiator-preferred",
      "repo": "negotiator",
      "attempt": 2,
      "tests": "green",
      "hidden": "red",
      "scenarios": {
        "passed": 257,
        "failed": 4
      },
      "review": {
        "verdict": "request_changes",
        "findings": [
          {
            "severity": "major",
            "text": "README does not document the option for languages"
          }
        ],
        "adapter": "openai-compatible",
        "model": "muse-glimmer:30b-mlx",
        "host": "ollama",
        "offline": true
      },
      "usd": 0.2304,
      "wallMs": 431000,
      "outcome": "graded red by the hidden tests; the run ended completed and its own tests were green; the review answered request_changes",
      "startedAt": "2026-10-30T09:12:00.000Z",
      "finishedAt": "2026-10-30T09:21:40.000Z"
    },
    {
      "live": true,
      "stintTask": "T-0001",
      "run": "r1",
      "adapter": "stint-agent",
      "model": "muse-spark-open",
      "host": "baseten",
      "endedBy": "capped",
      "retried": [],
      "estimated": false,
      "task": "negotiator-preferred",
      "repo": "negotiator",
      "attempt": 3,
      "tests": "red",
      "hidden": "red",
      "scenarios": {
        "passed": 255,
        "failed": 6
      },
      "review": null,
      "usd": 0.3125,
      "wallMs": 620000,
      "outcome": "graded red by the hidden tests; the run ended capped and its own tests were red",
      "startedAt": "2026-10-30T09:22:00.000Z",
      "finishedAt": "2026-10-30T09:33:30.000Z"
    }
  ]
}
